When to Use,Tool Name,Purpose,How
1,The Contextual Relevance Check™,For determining if evidence or premises are truly applicable and impactful in a given argumentative situation.,"Before accepting a premise or piece of evidence, ask: ""Given the specific context (e.g., formal debate, legal proceeding, everyday conversation), the intended audience, and the objective of this argument, is this reason truly relevant, acceptable, and sufficient?"". Recognize that the standards for these criteria are not universal; what is sufficient in one context may not be in another. If a premise seems out of place or its strength is ambiguous, probe its contextual fit, being aware of ""subject-matter-specific communication conventions"" that might apply. This tip highlights that argument evaluation is not a one-size-fits-all process."
1,The Framework Integration Filter™,"To prevent fragmented understanding by consciously connecting specific reasoning tasks to broader, generic theoretical structures.","When encountering a logical reasoning problem, avoid simply applying an isolated rule. Instead, reflect on how it fits into a ""generic explainable framework"" or overarching principles of argumentation. Ask yourself: ""What fundamental theory of logic, probability, or rational choice does this problem engage with, or what general type of fallacy is it an instance of?"" This helps consolidate isolated pieces of knowledge into a more coherent and applicable understanding."
1,The Interdisciplinary Lens Shift™,To unlock deeper insights into the nature and impact of arguments by consciously incorporating perspectives from diverse academic fields.,"When analyzing a complex argument, mentally ""approach[] the psychology discipline"" or consider insights from philosophy, cognitive science, and social psychology. Ask: ""What structural or attribute insights could psychology offer about why this argument is persuasive (or not) to humans?"". ""How might philosophical principles or cognitive biases identified by social science inform its underlying assumptions or the way it's presented?"". This broadens your analytical toolkit beyond pure formal logic."
1,The Actionable Problem Formulation™,"To clearly and unambiguously articulate a problem or an area for improvement, making it actionable for oneself or others.","When identifying a problem in reasoning or an area needing improvement, formulate it with extreme clarity and specificity, as if writing a ""GitHub issue description"". Ask: ""Is the 'problem_description' so clear that anyone (a 'software engineer' or another person) viewing it could understand precisely what needs to be fixed or implemented without additional context?"". This ensures that the problem is well-defined and ready for a solution."
1,The Dynamic Contextual Re-evaluation™,To ensure that reasoning remains relevant and appropriate by continuously re-evaluating its context as new information emerges.,"Recognize that the ""relevance of usual human reasoning is sensitive to contexts"". Don't assume a fixed context; be prepared to ""revise it"" as ""the development of inferences"" or new information arises. Ask: ""Has the underlying context of this problem or argument shifted, making my current line of reasoning less relevant or requiring a different approach?"" This is about adapting your reasoning to evolving situations."
1,The Embedded Normativity Decoder™,"To uncover and articulate the implicit, long-standing standards or principles that govern reasoning in a particular domain.","Instead of always searching for novel logical frameworks, look to existing practices (e.g., legal, scientific, everyday) and ""explain what the law has been doing all along"". Ask: ""What are the unspoken 'standards of proof' or underlying 'logic' that are implicitly applied in this context? Can I formalize or articulate these embedded norms to make them explicit and amenable to critical assessment?"" This helps to codify ""common sense"" into a testable framework."
1,The Ideological Contamination Detector™,"To identify and challenge ""pernicious ideas"" or manipulative arguments that exploit social dynamics.","Be vigilant for arguments or claims that seem ""nasty"" or spread too easily without critical scrutiny, as ""pernicious ideas seem to be the easiest to plant!"". Ask: ""Is this idea designed to exploit emotional responses or social biases? Does it resist investigation and challenge?"". This requires a sociological awareness of how ideas spread and influence people, enabling you to critically investigate and challenge them."
1,The Targeted Inquiry Framework (PICO)™,"To formulate clear, focused, and actionable questions for research or problem-solving, particularly in applied settings.","When developing a research question or framing a problem for investigation, use the PICO framework:<br>◦ Population of clients/subjects: Who is involved?<br>◦ Intervention: What is the proposed action or solution?<br>◦ Comparison: What is it being compared against (including doing nothing)?<br>◦ Outcome: What are the hoped-for results?. This structure helps ensure the question is ""well-formed,"" ""client oriented,"" ""practically important,"" and guides efficient information searches."
1,The Silent Majority Inference™,"To infer broader patterns or underlying issues from limited, explicit feedback.","When you receive explicit feedback or observe a problem, apply the principle: ""When you hear a complaint from somebody, I think it’s healthy to assume there are a lot more people who are unhappy"". This encourages looking beyond the immediately visible data to infer a larger, unspoken issue, prompting deeper investigation."
1,The Strategic Questioning Matrix™,To steer conversations and deepen understanding by using different types of questions for specific goals.,"When engaging in discussion or internal monologue, employ a ""Strategic Questioning Matrix"" to achieve different goals:<br>◦ Clarifying questions: ""Help us better understand what has been said"" (e.g., ""Can you tell me more?"").<br>◦ Adjoining questions: ""Explore related aspects of the problem that are ignored"" (e.g., ""How would this concept apply in a different context?""). (Implicitly, ""funneling"" questions for narrowing focus, and ""elevating"" questions for broadening scope, are also part of such a matrix, though not explicitly defined in the source snippets but suggested by contrast.)"
1,The Information Transformation Funnel™,To clarify the objective of any analytical task by defining the conversion of available information into necessary information.,"Before beginning any analytical or reasoning task, explicitly define the ""information transformation funnel"". Ask: ""What 'information that you have' (raw data, premises) needs to be converted into 'information that you need' (the conclusion, the specific prediction, the actionable insight)?"". Clearly articulating this conversion process helps to focus your reasoning and avoid extraneous analysis."
1,The Belief System Explorer™,To critically examine and understand the foundations and implications of one's own or others' belief systems.,"Engage in ""developing one's perspective"" by consciously ""creating or exploring beliefs, arguments, or theories"". Ask: ""What are the core tenets of this belief system? What are its strengths, weaknesses, assumptions, and implications? How does it compare to alternative belief systems?"" This systematic exploration helps to clarify, refine, or challenge existing perspectives."
1,"The Root Cause ""Five Whys"" Drill™",To systematically uncover the fundamental causes of a problem or phenomenon.,"When faced with a problem, ""repeatedly ask 'why'"" – typically five times – to delve deeper into its origins. Each answer becomes the basis for the next ""why"" question, helping to move beyond surface-level symptoms to ""identify the root cause of the problem"". This systematic questioning ""leads to deeper understanding of underlying issue"" but beware of ""oversimplif[ying] multifaceted problems through linear questioning""."
1,The Value-Driven Justification Probe™,To uncover and articulate the underlying values and emotional drivers that inform decisions and designs.,"When evaluating a decision or a solution, don't just ask for logical reasons. Also, ""prompt [yourself/others] with questions that will connect the rationality of design with [their] emotions so that they can articulate their values"". Ask: ""Why does this solution feel 'right' or 'important' to me/them? What underlying values or desired outcomes (beyond pure logic) are being served by this choice?"" This helps in understanding the holistic rationale."
1,The Cynefin Context Classifier™ (Domain Response Selector),"To classify problems or arguments into obvious, complicated, complex, or chaotic domains, prescribing tailored reasoning approaches to avoid mismatched methods and improve sense-making efficiency.","In Step 1, map the issue: Obvious (clear rules, sense-categorize-respond: Apply standard logic checks); Complicated (experts needed, sense-analyze-respond: Break with specialists like Venns); Complex (probe-sense-respond: Experiment via perturbations/counterfactuals); Chaotic (act-sense-respond: Stabilize first, then iterate). Ask: ""Is cause-effect repeatable (obvious) or emergent (complex)?"" Example: Simple syllogism (obvious)—direct truth-table; Ambiguous causal chain (complex)—probe with DAGs. This pre-reasoning selector integrates tools like inversion for chaos, ensuring your framing matches the problem's nature for robust starts."
1,The Wicked Problem Reframer™ (Non-Solvable Boundary Setter),"To recognize and reframe inherently messy, non-testable problems (e.g., value conflicts, no stopping rule) by resetting expectations, criteria, and iterative probes, avoiding futile linear optimization.","In Step 1, assess: No definitive solution? Interdependent issues? Stakeholder conflicts? If wicked, reframe: Define partial criteria (e.g., ""improve equity, accept trade-offs""); Probe iteratively (complex domain style). Example: Ethical dilemma argument—""No 'true' win; track via multi-criteria charter."" Use MECE for partial decomps. This guards against overconfidence in chaotic realms, guiding framing toward pragmatic, evolving sense-making."
1,The Fermi Plausibility Estimator™ (Order-of-Magnitude Grounder),"To quickly gauge argument or claim plausibility via back-of-the-envelope calculations, anchoring explorations in rough quantitative reality to debunk or support intuitions.","In Step 1, break to orders: Estimate components (e.g., ""Success rate? 10^2 people × 10^-1 prob = 10 outcomes""). Chain: Multiply for totals, flag implausibles (e.g., ""1 in a million? Unlikely without fat tails""). Example: ""Policy affects millions""—Fermi: Base rate 1% impact × pop = realistic? Adjust via sensitivity. Pair with dimensional analysis (units match?). This first-principles scoping filters nonsense early, grounding framings quantitatively."
2,The Recursive Decomposition Method™,"To effectively manage and solve complex logical problems by breaking them into smaller, more tractable components.","When faced with a complex problem that appears ""chaotic,"" consciously break it down into a sequence of simpler, interconnected ""reasoning steps"" or ""intermediate conclusions"". Structure your line of reasoning so that ""first things come first"" and related arguments are dealt with together, leading logically from one step to the next. This systematic decomposition helps clarify the problem, identifies points of implicit reasoning, and ensures that each part is logically addressed, making multi-hop reasoning manageable."
2,The Progressive Elaboration Strategy™,"To tackle complex reasoning problems by breaking them into manageable sub-problems and solving them sequentially, building upon each solution.","When confronted with an argument or problem that seems overwhelming, apply a ""least-to-most prompting"" approach. This involves systematically breaking down the complex problem into ""simpler subproblems,"" solving each subproblem, and then using that solution to help solve the next, more complex subproblem until the overall problem is resolved. This prevents being overwhelmed by complexity and manages the ""cognitive cost""."
2,The Experience-to-Reasoning Bridge™,"To effectively integrate empirical observations with logical inference, allowing for reasoning based on learned patterns.","When developing an argument, consciously connect ""learning from experience"" with ""reasoning from what was learned"". If you notice a recurring pattern or acquire knowledge from experience, explicitly translate that into a symbolic rule or a logical premise from which further inferences can be drawn. This ensures your logical arguments are grounded in real-world observations and that your observations inform your formal reasoning."
2,The Hidden Mechanism Uncoverer™,To infer unobservable underlying structures or processes that explain observed phenomena or behaviors.,"When faced with a complex system or behavior, hypothesize about the ""microcircuit motifs"" or ""computational processes"" that must be operating beneath the surface to produce the observed outcomes. Ask: ""What are the minimal, interacting components or steps that, if present, would logically account for this observed behavior or phenomenon?"" This involves inferring underlying mechanisms from external observations."
2,The Superficial First Pass™,"To quickly gain initial insights into a complex problem by starting with a simplified, ""superficial"" analysis.","When faced with a complex problem, resist the urge for immediate deep dives. Instead, conduct an ""initial fast and simple approach to modeling"" or analysis. This ""superficial"" first pass often ""makes clear many of the interactions between system and policy"", revealing key dynamics and areas that warrant more detailed investigation in ""later revisions."" This is an efficiency measure to quickly identify the most fruitful avenues for deeper analysis."
2,The Domain-Invariant Feature Extractor™,"To identify core, generalizable features or principles that hold true across different contexts or domains.","When analyzing information from multiple domains or applications, actively look for ""domain-invariant feature[s]"". Ask: ""What are the underlying patterns, principles, or causal relationships that remain consistent despite superficial differences across various contexts?"" Extracting these invariant features helps in building more robust and transferable knowledge."
2,The Abstraction by Analogy™,To simplify complex realities and gain insight by abstracting key principles and applying them to analogous situations.,"When a concrete problem seems overwhelming, try the ""method of analogies"". ""Abstract from concrete reality"" by identifying the core, simplified principles or relationships at play, and then ""use a suitable analogue"" from a different domain to understand and potentially solve the problem. This helps to strip away distracting details and focus on essential structural similarities."
2,The Idea Capture Net™,"To systematically capture and preserve nascent ideas, regardless of their immediate perceived quality, for later review and development.","To ""nurture your creative side"" and prevent loss of insights, maintain a dedicated system (e.g., notebook, digital tool) to ""jot down any inspirations — good or bad"". ""Remember, ideas can also slip away very easily"". The goal at this stage is pure capture, deferring ""weeding down"" or evaluation for a later, more analytical phase."
2,The Information Processing Pipeline™,To systematically organize and make sense of information in problem-solving.,"When dealing with information for problem-solving, follow a ""State-gather-analyse"" pipeline:<br>1. State: Clearly define the current understanding or problem state.<br>2. Gather: ""Collate and organise"" relevant information, condensing and summarizing it.<br>3. Analyze: ""Make better sense of the original problem,"" which may lead to fine-tuning initial questions or re-stating the problem. This structured approach helps manage information flow and clarity."
2,The Recursive Idea Sculptor™,"To develop and refine ideas through an iterative process of detailed examination, broader reflection, and focused testing.","When developing an idea, use the ""look close, look away, look back loops"":<br>1. Look Close (Ask Why): Deeply interrogate the idea with ""lots of brainstorming techniques that often boil down to the simple skill of asking yourself questions"".<br>2. Look Away: Step back to gain a broader perspective.<br>3. Look Back (Test Idea): ""Suppose an action, think about what effects and consequences may follow and then take those insights back to your starting idea to see whether you can improve it"". This iterative process, or ""iteration,"" continually shapes and improves the idea."
2,The Radiant Idea Weaver™,"To generate and organize ideas by leveraging the brain's associative nature through non-linear, radiant visual structures.","When brainstorming or organizing complex information, use a ""mind map"". Structure information ""in a radiant rather than linear manner,"" with a core idea in the center and ""connections radiating out"" to sub-divisions and specific examples. This method exploits the brain's preference for ""association"" and ""multiple connections and comparisons simultaneously"" to stimulate and organize thoughts."
2,The Multi-Hop Reasoning Deconstructor™,"To break down complex arguments that rely on implicit, chained inferences into explicit, manageable steps supported by evidence.","When analyzing an argument that seems to jump to conclusions, or relies on ""implicit multi-hop reasoning,"" consciously ""decompose"" it into its constituent ""reasoning steps and evidence paragraphs"". Identify each logical jump and demand explicit justification or evidence for that step. This helps reveal unstated assumptions and strengthens the logical chain."
2,The Irregularity Navigator™,"To effectively analyze and reason about systems with complex, unpredictable, and multi-level interconnections.","When dealing with systems characterized by ""innately completely irregular and unpredictable"" structures (like real-world networks or complex arguments with many implicit links), explicitly acknowledge that ""connectivity happens at multiple levels"". Develop strategies to map and understand these complex interdependencies, rather than forcing them into simpler, linear models. This requires a flexible approach to identify both direct and indirect influences."
2,The Strategic Diversity Enforcer™,To actively promote the exploration of a wide range of problem-solving strategies and prevent cognitive entrenchment.,"When approaching a problem, consciously ""discourage repeated use of the same strategy"". If an initial strategy isn't yielding results, deliberately switch to a different one. This ""enforces diversity"" in your problem-solving toolkit and pushes you to explore a ""broad and diverse set of strategies"" rather than relying on familiar but potentially suboptimal methods."
2,The Hierarchical Strategy Learner™,"To optimize decision-making and resource allocation in complex, multi-level problems by learning and applying strategies at different hierarchical levels.","When a problem can be decomposed into hierarchical levels (e.g., strategic overarching goals and tactical sub-problem execution), apply a ""hierarchical strategy learner"". Make ""decisions at two different levels"": at the high ""system level"" (allocating resources, setting priorities), and at the lower ""subsystem level"" (optimizing individual components). Learn heuristics for each level, recognizing that different components may require different strategies for improvement, and ensure feedback between levels."
2,The Deep Relational Pattern Seeker™,"To move beyond surface-level observations to identify fundamental, structural relationships within data or arguments.","When analyzing information, don't stop at merely identifying individual facts or categories. Actively search for ""deep relational identities in data"". Ask: ""How do the parts relate to one another? What are the underlying abstract structures or patterns that govern their interactions?"" This pursuit of deeper connections reveals the true functional organization."
2,The Generalized Mental Operation Transfer™,"To rapidly adapt to novel problem settings by transferring generalized ""mental operations"" or ""programs for control.""","When faced with a new problem, instead of starting from scratch, consciously ""generalize an ability to deploy mental operations—or transfer programs—to devise new solutions on the fly"". This involves taking a ""program"" (a sequence of cognitive steps, like gathering, sorting, shelving) and applying it to a new domain (e.g., tidying a room, navigating a city). This ""compositional"" thinking allows for rapid adaptation."
2,The First Principles Decomposer™ (Munger's Fundamental Breakdown),"To strip complex problems or arguments down to their most basic, undeniable truths, avoiding assumptions and enabling clearer reconstruction from the ground up.","Inspired by Munger's emphasis on first principles reasoning, begin by questioning every layer: Ask ""What do we know to be absolutely true here, without relying on analogies or conventions?"" Break the argument or problem into atomic elements (e.g., core facts, definitions, axioms), discarding anything derived or composite. For an LSAT-style argument like ""All successful leaders are charismatic, so charisma is essential,"" decompose to: ""What defines success? What is charisma? Are there counterexamples of non-charismatic leaders?"" Rebuild only from verified basics, ensuring your exploration in Step 2 is rooted in reality rather than inherited ideas. This prevents building on shaky foundations and fosters innovative, latticework-integrated solutions."
2,The Feedback Loop Detector™ (Systems Cycle Scanner),"To identify reinforcing or balancing cycles in arguments or problems, revealing hidden dynamics that amplify or stabilize outcomes.","Munger's systems thinking (feedback loops) aids Step 2: Map interactions—""Does this premise create a positive loop (e.g., confirmation bias reinforcing beliefs) or negative (self-correcting via doubt)?"" For complex breakdowns, trace: ""How does A affect B, which feeds back to A (e.g., envy escalating in debates)?"" Use biology (predator-prey cycles) or economics (network effects). Example: In a policy argument, detect bullwhip amplification in supply chains. Prune destructive loops with via negativa. This uncovers emergent behaviors, making your exploration more systemic and predictive."
2,The Conditional Chain Translator™ (Sufficient-Necessary Decoder),"To fluently convert natural language conditionals (""only if,"" ""unless,"" chains) into logical forms, mastering contrapositives and avoiding sufficient/necessary confusions in argument decomposition.","In Step 2, use a one-pager ruleset: ""P only if Q"" ≡ P → Q; ""P unless Q"" ≡ Q → ¬P or (P ∧ ¬Q) → false; ""P if and only if Q"" ≡ P ↔ Q. For chains: ""P only if Q and R"" → Break to P → Q ∧ R, contrapose (¬Q ∨ ¬R) → ¬P. Drill: Rewrite stems, then contrapose to verify (e.g., ""Study unless sick"" → Sick → No study). Example: ""Success only if effort"" → Effort necessary; test assumptions like ""No effort, no success."" This baseline module sharpens breakdowns, preventing translation errors that cascade into flawed explorations."
2,The Toulmin Scaffold Mapper™ (Argument Anatomy Tracer),"To universally map arguments via claim-grounds-warrant-backing-qualifier-rebuttal structure, providing a shared vocabulary for quick dissection before evaluation or matching.","In Step 2, one-minute map: Claim (conclusion); Grounds (evidence); Warrant (inference rule); Backing (warrant support); Qualifier (scope, e.g., ""usually""); Rebuttal (exceptions). Diagram as flowchart. Example: ""Exercise helps health (claim); Studies show it (grounds); Correlation implies causation (warrant, but weak backing); Unless injured (rebuttal)."" Use for Role/Method: Identify gaps. This scaffold standardizes breakdowns, illuminating hidden assumptions for principle or method-of-reasoning items."
2,The Ladder of Inference Climber™ (Leap Detector and Grounder),"To make unconscious jumps from data to conclusions explicit, catching premature assumptions or biases during exploration and ensuring grounded, traceable breakdowns.","In Step 2, climb the ladder: 1) Data (raw facts); 2) Selected data (what's ignored?); 3) Meanings (cultural lens?); 4) Assumptions (e.g., availability bias); 5) Conclusions (testable?); 6) Beliefs (confirmation trap?); 7) Actions. Ground by questioning each rung: ""What data supports this meaning?"" Example: ""Leader succeeded"" → Selected: Wins only (survivorship?); Assumption: Charisma key. Reverse-climb from conclusion. Integrate with semantic precision. This visualizes mental paths, preventing lock-in and enhancing idea exploration clarity."
