When to Use,Tool Name,Purpose,How
4,The Decision Quality Gatekeeper™ (Six-Element Validator),"To gate final recommendations by verifying all six DQ dimensions—frame, alternatives, info, reasoning, commitments, process—ensuring high-value, defensible outcomes in reviews.","In Step 4, scorecard: 1) Frame (clear?); 2) Alternatives (creative?); 3) Info (reliable?); 4) Reasoning (sound?); 5) Values (aligned?); 6) Action (committed?). Pass if all >7/10. Example: Tweak fails if alternatives narrow—Regenerate. Use with trade-off charters. This DQ framework failsafes against polished but flawed work, elevating tweaks to quality-assured closure."
4,The Consistency & Parsimony Gatekeeper™ (Quality Control Sentinel),"To apply lightweight pre-shipment checks for internal consistency, parsimony, and operationalizability, filtering out over-engineered or contradictory reasoning before finalizing reviews.","In Step 4, gate with triad: 1) Consistency (No premise contradictions—scan map); 2) Parsimony (Minimal parts for objective? Prune extras); 3) Feasibility (Peer-run in time? Test dry-run). Fail = Revise. Example: Tweak adds complexity—Gate: ""Does it simplify without loss?"" Use MECE for audit. This ensures polished, lean outputs, preventing elegant but impractical conclusions."
"1, 2",The Assumption Audit™ (Hidden Premise Hunt),To uncover and evaluate unstated or implicit premises that an argument relies upon.,"Actively look for underlying ""unstated assumptions"" or ""suppressed premises"" that an argument needs to hold true for its conclusion to follow. Ask yourself: ""What must be true for this conclusion to necessarily follow from these stated premises?"". Pay attention to contexts that are unfamiliar, as these often hide crucial assumptions. Additionally, identify when the motivations or subtle self-interest of the arguer might be influencing these unstated assumptions, introducing potential bias. If you find it necessary to make an assumption to progress an argument, do so deliberately and be prepared to justify it."
"1, 2",The Rigorous Definition Drill™,"To establish absolute clarity and precision in the meaning of terms and concepts within an argument, eliminating ambiguity.","For any critical term, concept, or claim in an argument, demand a ""rigorous generalization and formulation"". Ask: ""Is this concept defined so precisely that its interpretation would remain constant and relevant, regardless of the specific context or explanatory approach?"". This ensures that any subsequent analysis or evaluation is based on an unambiguous understanding, preventing shifts in meaning from undermining logical integrity."
"1, 2",The Semantic Precision Check™,"To ensure that natural language statements in an argument are accurately interpreted, preventing misinterpretations that lead to faulty inferences.","When analyzing arguments presented in natural language, pay meticulous attention to the ""semantic parsing procedure"". Ask: ""Could any phrase or sentence be misinterpreted? Are there ambiguities in 'naturalistic language use' that could lead to different logical forms?"". If ambiguity is present, clarify the precise meaning before proceeding with logical evaluation. This helps prevent ""faulty deductive inferences"" that originate from language interpretation errors."
"1, 2",The Human-AI Synergy Mapper™,To understand and optimize complex problem-solving by discerning the distinct and complementary roles of human and automated reasoning.,"When addressing a problem that involves both human intuition and structured processes (even if metaphorical ""machine"" processes), explicitly ""map[]"" the roles of the ""human and machine components"". Ask: ""Where does human 'experienced insight' provide unique value, and where can structured 'machine' processes provide 'increasing leverage in the solution of complex problems'?"". This helps in strategically allocating cognitive resources."
"1, 2",The Problem Reframe Challenge™,To overcome analytical stagnation by fundamentally redefining or re-conceptualizing the problem at hand.,"If your current approach to a problem isn't yielding results, ""start by reframing it"". Ask: ""Am I looking at the right problem? Is there a different way to conceptualize the core issue that might unlock new solutions?"" This involves stepping back and challenging the initial definition of the problem."
"1, 2",The Experiential Analysis Loop™,"To integrate practical experience into analytical reasoning, recognizing that direct engagement informs deeper understanding.","When analyzing a problem, particularly a complex or novel one, understand that ""analysis is only possible in the light of experience gained while attempting to solve the problem"". Don't wait for perfect information; engage in ""action"" to gain ""experience,"" and then use the results of that action to ""develop a more complete understanding of the issue"". This iterative cycle between action and analysis is crucial for real-world problem-solving."
"1, 2",The MECE Pyramid Structurer™ (Exhaustive Decomposition Builder),"To organize problem framings and explorations into mutually exclusive, collectively exhaustive (MECE) hierarchies via top-down pyramid logic, ensuring comprehensive yet non-overlapping coverage.","In Steps 1 and 2, build pyramid: Top (governing idea, e.g., core argument); Middle (key supports, MECE groups: e.g., Premises/Assumptions/Evidence); Bottom (data/examples). Check MECE: No overlaps/gaps? Example: Flaw question—Group: Logical (contradiction), Evidential (weak support), Bias (confirmation). Use for Toulmin mapping. This scaffolds clear, scannable structures, preventing fragmented or redundant explorations."
"1, 2",The Estimative Probability Lexicon™ (Verbal-Numeric Binder),"To standardize vague language (""likely,"" ""probably"") with numeric ranges and confidence qualifiers, ensuring consistent, interoperable judgments in framings and breakdowns.","In Steps 1 and 2, adopt Kent/IC scales: ""Likely"" = 60-80%; ""Highly likely"" = 80-95%; Always add CI (e.g., ""Likely [60-80%]""). Document in logs. Example: Premise strength—""Almost certainly [90%+]"" vs. ""Possible [20-40%]."" Train via calibration drills. This prevents ambiguity creep, aligning verbal intuition with precise, reviewable probabilities."
"1, 2, 3, 4",The OODA Loop Integrator™ (Adaptive Decision Cycle),"To accelerate effective reasoning by cycling through observation, orientation, decision, and action, incorporating latticework for rapid adaptation in dynamic contexts.","Munger's personal effectiveness via OODA (observe–orient–decide–act) spans all steps: In 1, observe context/bases; 2, orient via decomposition/biases; 3, decide with second-order tests; 4, act and loop back with updates. Ask: ""What new info (observe)? How does it fit my latticework (orient)? Best path (decide)? Implement and test (act)?"" Use psychology (stress-influence) and systems (feedback). Example: In a debate, observe counters, orient with base rates, decide rebuttal, act via clarification. This builds agile, compounding habits for iterative mastery."
"1, 3",The Data Quality Disclosure™,To openly inform the audience about any potential limitations or quality issues with the raw data underlying an argument.,"When an argument relies on empirical data, explicitly ""communicate data quality to users to let them know how the results are influenced by the data used"". Define and measure ""dimensions of data quality"" (e.g., accuracy, completeness, timeliness, consistency). If there are significant data problems, provide ""disclaimers"" to educate end-users about the ""risks involved in incorrect explanations""."
"1, 3",The Uncertainty Space Mapper™,To systematically investigate the landscape of possibilities and uncertainties to inform decision-making.,"When confronting a problem with many unknown variables, distinguish between ""exploration"" and ""search"" strategies. ""Exploration"" involves ""systematically sampling points"" in the ""uncertainty space"" to understand its ""global properties"" (e.g., ""under what circumstances would this policy do well/fail?""). ""Search"" is used to ""identify more precisely where the boundary is located between distinct regions"" of success and failure. Combine these iteratively to refine understanding and policy design."
"1, 3",The Unified Multimodal Interpreter™,To enhance reasoning capabilities by effectively integrating and making sense of information from diverse data types or modalities.,"When an argument or problem involves different kinds of information – ""text, images, structured graph data, and potentially more"" – actively seek to integrate them ""into a unified analytic framework"". Ask: ""How do insights from one modality (e.g., visual evidence) complement or contradict those from another (e.g., textual reports)? How can their strengths be harnessed to enhance overall reasoning?"". This aims for a holistic interpretation across heterogeneous data sources."
"1, 3",The Multi-Perspective Reframe™,To gain a more comprehensive understanding and unlock novel solutions by consciously examining a problem from diverse viewpoints.,"When stuck on a problem, perform a ""perspective shift"". Ask: ""How would someone with a different background, expertise, or cultural outlook approach this problem? How does 'figuring out how to think about the problem' from multiple angles provide a 'more comprehensive picture' and 'better ideas'?"". This broadens the solution space and can inspire ""different directions""."
"1, 3",The Scalable Uncertainty Navigator™,"To effectively manage and reason with incomplete or uncertain information in complex, large-scale problems.","When confronted with problems involving extensive ""uncertainty and incomplete information"", recognize the challenge of ""scalability and complexity."" Instead of seeking perfect information, develop strategies to ""handle uncertainty and incomplete information"" by, for example, identifying critical gaps, making justifiable assumptions, or using probabilistic reasoning. The goal is to make robust decisions despite inherent limitations."
"1, 3",The Base Rate Reality Anchor™ (Statistical Prior Grounder),"To ground initial assessments and evaluations in empirical frequencies, countering intuitive overconfidence and base-rate neglect for more probabilistic thinking.","Munger's base rates combat availability bias in Step 1: When framing the problem, ask: ""What's the historical success rate here (e.g., 70% of similar arguments fail due to causation errors)?"" In Step 3, anchor tests: ""Does this fit the base rate, or am I ignoring regression to the mean?"" Use statistics like law of large numbers for reliability. For an overconfident claim (""This investment always wins""), check: ""Base rate for such strategies: 20% long-term success."" Integrate with Bayesian updating for refinement. This anchors your latticework in data, preventing emotional or narrative-driven drifts."
"1, 3",The Map-Territory Alignment Check™ (Reality Fidelity Test),"To ensure models, assumptions, or arguments accurately reflect the real world, bridging the gap between abstractions and actual conditions to avoid self-deception.","From Munger's ""map vs. territory,"" in Step 1, verify framing: ""Does my mental model match observable reality, or is it distorted (e.g., by hindsight bias)?"" In Step 3, test: ""If this map is wrong, what territory evidence contradicts it (e.g., survivorship bias ignoring failures)?"" Use epistemology tools like Lindy's effect for durability checks. Example: For a success story argument, ask: ""Is this map selective, ignoring mean reversion?"" Align with skin in the game: ""Would stakeholders' real stakes change the territory?"" This keeps your latticework grounded, preventing elegant but false constructs."
"1, 3",The Provenance Ledger Tracker™ (Evidence Origin Auditor),"To verify the reliability and independence of evidence or premises by tracing their source chain, uncovering biases, tampering, or weak foundations that could invalidate claims.","In Steps 1 and 3, for every key fact or premise, build a ""ledger"": Note origin (e.g., primary study? Secondary report?), independence (e.g., funded by interested party?), citation trail (trace back 3 levels for distortions), and tamper checks (e.g., raw data available?). Flag red flags like anonymous sources or echo-chamber citations. Use a simple table: Columns for Source, Incentives, Verification Date, Confidence. Cross with source-credibility models (e.g., track record score). Example: For a statistic, ask: ""Does the chain hold, or is it selective quoting?"" This ensures your big-picture framing and piece checks rest on trustworthy custody, avoiding ""garbage in, garbage out."""
"1, 3",The Deception & Rhetoric Forensics Kit™ (Manipulation Detector),"To dissect arguments for rhetorical tricks, deceptions, or framing biases like motte-and-bailey or paltering, ensuring fair evaluation beyond surface logic.","In Steps 1 and 3, apply a red-team checklist: Scan for motte (weak claim defended) vs. bailey (strong one advanced); paltering (half-truths); sealioning (endless demands); selective quoting (cherry-picking). Test implicature: ""What's implied but not said (Gricean maxims)?"" Steelman first: Rephrase strongest version, then critique. Flag visuals/framing (e.g., misleading scales). Use psychology (liking bias via anecdotes). Example: ""This policy works!""—forensic: Is it equivocation on ""works""? Document findings. This uncovers adversarial persuasion, fortifying your contextual grasp and piece checks against manipulation."
"1, 3",The Pragmatics Pass Filter™ (Implicature Interpreter),"To detect and resolve pragmatic misfires in language, distinguishing literal semantics from implied meanings or norm violations that distort arguments.","In Steps 1 and 3, apply Gricean maxims: Quantity (not too much/little info?), Quality (truthful?), Relation (relevant?), Manner (clear?). Probe implicature: ""What's reasonably inferred (e.g., 'some' implying 'not all')?"" Test violations: Over-informativeness (red herring)? Ambiguity (equivocation)? Rephrase neutrally: ""If audience assumes X from Y, does it hold?"" Use rhetoric forensics for framing. Example: ""Everyone knows...""—pragmatic overclaim via social proof. Adjust by clarifying. This bridges semantics to real communication, preventing disputes from linguistic traps in framing and checks."
"1, 3",The Key Assumptions Scrubber™ (Core Belief Auditor),"To ritualize the identification, confidence-rating, and disconfirmation planning for foundational assumptions, preventing early hypotheses from biasing the entire reasoning process.","In Steps 1 and 3, list 3-5 core assumptions (e.g., ""Premise X is unbiased""). Rate confidence (e.g., 70%); List disconfirmers (e.g., ""Incentive conflict evidence""); Specify triggers (e.g., ""If new source contradicts, drop to 30%""). Review pre- and post-analysis. Example: In framing a causal argument, scrub: ""Assumes no confounders—disconfirm via DAG check."" Integrate with ladder of inference to trace origins. This Heuer-inspired ritual surfaces shape-shifting beliefs, ensuring framings and tests start clean."
"1, 3",The Deception & Counter-Deception Probe™ (Benefit-Seeker Detector),"To systematically scan for deception motives and indicators in premises or sources, hypothesizing denial/deception scenarios to harden against manipulative inputs.","In Steps 1 and 3, checklist: 1) Beneficiaries (""Who gains if accepted?""); 2) Deception hypothesis (""If lying, what traces—omissions, inconsistencies?""); 3) Indicators (e.g., Over-precision, source opacity). Test: ""Expect under deception?"" Example: Expert claim—Probe: Incentive alignment? Pair with provenance ledgers. This tradecraft addition flags paltering or biases, fortifying framings and checks against adversarial noise."
"1, 3",The Reference Class Anchor™ (Outside-View Forecaster),"To counter narrative biases by anchoring initial assessments to empirical base rates from similar cases, then adjusting for specifics to ground framings and tests realistically.","In Steps 1 and 3, identify class: ""Similar arguments—What % hold (e.g., 60% causal claims fail on confounders)?"" Anchor, then adjust (+/- for uniques). Example: Principle application—Base: 40% success rate; Adjust +10% for strong warrant. Avoid planning fallacy: ""Outside view first."" Pair with Fermi for scoping. This planning-fallacy antidote ensures probabilistic realism from the start."
"1, 3",The Requirements-Metrics Traceability Matrix™ (Objective-Link Auditor),"To link every objective to observable, pre-decision metrics with expected effect sizes, ensuring reasoning efforts target measurable impacts and avoid untraceable ""nice-to-haves.""","In Steps 1 and 3, build a matrix: Columns—Objective (e.g., ""Validate sufficiency""), Input Metrics (e.g., ""LR >3""), Decision Variable (e.g., ""Accept premise""), Expected Effect (e.g., ""Reduce false positives 20%""). If unmeasurable, deprioritize. Example: For flaw detection—""Trace to Brier score improvement of 0.05."" Review gaps pre-test. This bridges aspirations to empirics, aligning framings and checks with verifiable needle-movers."
"1, 3",The D&D Source Drill™ (Adversarial Uncertainty Expositor),"To probe for denial/deception in evidence chains using reliability-credibility matrices and forensics, tying to OSINT/digital traces for induced uncertainty in high-stakes intel or arguments.","In Steps 1 and 3, matrix: Source (Reliable?) × Info (Credible?); Chain-of-custody (Tamper?); Corroborate (Cross-sensors?). Example: ""Expert claim""—Drill: Motive matrix, Digital forensics (Edits?). Fail: Gaps in custody. Integrate deception forensics. Pass: Corroborated, no red flags. This hardens against manipulation, clarifying induced fog in framings and tests."
"1, 3",The Frame-Flip Valence Tester™ (Bias-Resistant Rephraser),"To detect framing effects (e.g., loss/gain, moral) by restating claims in multiple lenses, failing if decisions flip due to valence alone, exposing omission or efficacy biases.","In Steps 1 and 3, panel: 3+ frames (e.g., Gain: ""Wins X""; Loss: ""Loses Y""); Re-decide (e.g., Accept?); Check flip. Example: ""Policy effective""—Flip to risk frame; Fail if valence shifts verdict sans evidence. Use pragmatics pass. Pass: Stable core. This neutralizes rhetorical biases, ensuring equitable evaluations."
"1, 4",The Intuition Interrogator™ (System 1 Bypass),"To prevent ""fast and frugal heuristics"" and cognitive biases from leading to logically incorrect conclusions.","Be acutely aware that your initial, ""System 1"" (intuitive, fast) response to an argument might be influenced by factors other than pure logic, such as personal beliefs (""belief bias""), surface-level patterns (""atmosphere effect,"" ""matching heuristic""), or emotional content. When an argument's conclusion aligns with your existing beliefs or seems ""likeable,"" pause and deliberately engage ""System 2"" (deliberative, slow reasoning). Actively search for counter-examples or alternative interpretations that challenge the intuitive conclusion. Recognize that this deliberate process has a ""cognitive cost"" but is essential for logical accuracy and avoiding ""unfaithful reasoning""."
"1, 4",The Ante-Hoc Clarity Audit™,"To ensure that a reasoning process is inherently transparent and comprehensible as it is being developed, rather than attempting to justify it after the fact.","Instead of trying to explain your reasoning post-hoc, strive to make your entire thought process ""fully transparent throughout the entire process of creation, exploitation, and exploration"". At each step, ask: ""Can this local or global step of reasoning be clearly described in natural language, consistent with human understanding, as I am formulating it?"". This proactive approach embeds clarity directly into the reasoning itself, making it more robust and easier to communicate."
"1, 4",The Iterative Intelligence Cycle™,"To systematically gather, analyze, and communicate information to inform decision-making, with continuous feedback for improvement.","When tackling a problem requiring information gathering and decision-making, follow an ""iterative intelligence cycle"". Start with ""Conversation"" to ""establish needs,"" then ""Collect data,"" ""Convert data"" (analyze it), and ""Communicate intelligence"". Crucially, integrate ""feedback loops"" at every stage: after action is taken, reflect on its effectiveness to refine the ""needs,"" ""data collection,"" and ""analysis"" for the next cycle."
"1, 4",The Unknown-Unknowns Drill™ (Horizon Blindspot Hunter),"To proactively surface potential ""unknown unknowns"" through structured wild-card generation and early-warning indicators, mitigating tail-risk oversights in reasoning.","In Steps 1 and 4, drill: Brainstorm via red-teaming—""What assumptions fail under wild cards (e.g., black swans like paradigm shifts)?"" Categorize: Known knowns (facts), known unknowns (gaps), unknown unknowns (unimagined). Set indicators (e.g., anomaly thresholds). Use fat tails/power laws for priors. Example: Argument assumes stability—drill: ""What if regime shift (e.g., AI disrupts logic tools)?"" Tweak with robustness (antifragility buffers). Integrate inversion for failure paths. This expands your big-picture vigilance and reviews, turning invisibles into actionable foresight."
"1, 4",The Reasoning Process Canvas™ (Analysis Blueprint Drafter),"To create a one-page ""bill of materials"" for reasoning workflows, capturing scope, inputs, rules, mappings, and owners for transparent audits, handoffs, and iterative improvements.","In Steps 1 and 4, fill canvas: Scope/Users (e.g., ""Flaw detection for LR""); Determinants/Sources (e.g., ""LR, Base rates""); Scoring (rubrics); Mapping (to decision); Cadence/Owners (e.g., ""Weekly review, Analyst A""). Example: For causal checks—""Inputs: DAGs; Output: Accept threshold."" Update post-use. This meta-tool makes processes auditable, easing scaling and collaboration in framings and tweaks."
"1, 4",The Operational Feasibility Criterion™ (Usability First-Class Filter),"To evaluate reasoning methods on execution practicality—time, data access, repeatability—ensuring deployable tools over theoretical ideals, with explicit trade-offs.","In Steps 1 and 4, score: Time (<5 min?), Data (Available?), Repeatability (Non-author viable?). Threshold: >7/10 or reject/refine. Example: Complex CBC—""Too slow for live tests; Simplify to pairs."" Weigh vs. accuracy. This pragmatism filter keeps framings and tweaks grounded in real constraints, avoiding unusable sophistication."
"2, 3",The Deliberative Search Tree™,To systematically explore multiple reasoning paths and self-correct errors in complex logical tasks.,"Instead of following a single linear path of reasoning (""chain-of-thought""), explicitly generate a ""tree of thoughts"" or ""program of thoughts"". This involves branching out to explore different intermediate reasoning steps or hypotheses, allowing for ""self-repair"" when a path leads to a dead end. Actively ""backtrack"" when inconsistencies or errors are identified, and explore alternative branches to find the optimal solution."
"2, 3",The Bidirectional Implication Trace™,To thoroughly analyze cause-and-effect relationships and their implications by tracing influences in both forward and backward directions.,"When examining a causal claim or a sequence of events, don't just consider the forward flow from cause to effect. Also, trace backward: ""What antecedent conditions or prior events must have been true for this effect to occur?"". Then, trace forward again: ""What necessary consequences follow from this cause?"" This ""bidirectional processing"" helps to identify hidden assumptions, missing steps, or unacknowledged downstream effects, ensuring a more complete causal understanding."
"2, 3",The Structured Analogy Generator™,"To leverage analogical reasoning for problem-solving and inference, focusing on ""close"" and role-based comparisons for stronger support.","When encountering a new problem, actively generate ""analogous problem[s]"" or situations. Focus on ""close analogies in which similar entities fill corresponding roles"" to provide ""stronger support for plausible inferences"". For example, explicitly map the roles, relationships, and underlying principles between the known and unknown domains, making analogical transfer more reliable and insightful."
"2, 3",The Analogical Leap Generator™,To stimulate creative insights and generate new ideas by deliberately drawing analogies between seemingly unrelated domains.,"Recognize that ""analogies are an essential element in thinking, and often at the heart of creative insights"". When stuck, consciously look for a problem in a completely different domain that shares a structural similarity. This ""analogical leap"" can bypass ""routinised methods"" and help generate novel solutions by transferring relational properties."
"2, 3",The Mechanistic Hypothesis Mapper™,To generate and validate hypotheses about the underlying causal mechanisms or steps within a complex reasoning process.,"When analyzing a complex system's output, create a ""graph description"" of the ""individual computational steps"" that lead to the result. This ""attribution graph"" helps generate ""hypotheses about the mechanisms used"". ""Test and refine"" these hypotheses through ""perturbation experiments"": deliberately alter components or inputs and observe the changes in subsequent steps or the final output. This reveals the true functional role of each part."
