When to Use,Tool Name,Purpose,How
3,The Formal Verification Seal™,"To ensure the correctness and reliability of a reasoning system by applying rigorous, systematic verification methods.","For critical arguments or decisions, apply ""verification"" techniques. This involves systematically checking each step of the reasoning against established rules, axioms, or formal proofs to ensure its absolute correctness and consistency. The goal is to obtain a ""formal verification"" that leaves no room for logical error, akin to ensuring ""safety and reliability"" in engineering."
3,The Hypothesis Stage Gate™,To distinguish and optimize the distinct cognitive processes involved in generating new hypotheses versus selecting among existing ones.,"Clearly separate the ""generating new diagnostic hypotheses"" phase from the ""selecting hypotheses for further"" investigation. Recognize that the ""reasoning processes involved"" are different. When generating, focus on ""creativity and imagination"" and ""divergent thinking"". When selecting, apply analytical rigor and criteria (e.g., consistency, coherence, simplicity) to choose the ""best explanation"". Avoid mixing these stages prematurely."
3,The Abductive Discovery Engine™,To systematically generate novel hypotheses to explain surprising or anomalous observations.,"When confronted with ""incomprehensible finding[s] in the data"" or ""anomalies,"" engage your ""abductive reasoning"". This means mentally creating or finding a ""new theory"" that provides ""a better explanation of a set of data"" than mainstream wisdom. This process starts with the ""discovery of a hypothesis,"" then moves to deduction (deriving predictions) and induction (verifying assumptions). It's a ""cyclical procedure"" where new data refines the argument."
3,The Evidence-Constrained Inference™,"To ensure that conclusions are strictly derived from available evidence, avoiding unwarranted leaps or unsupported assumptions.","When drawing conclusions, ""infer only what the evidence implies"". Resist the urge to go beyond what the facts explicitly support. Crucially, ""check inferences for their consistency with each other"" and ""identify assumptions underlying your inferences"". Inconsistent inferences or unstated assumptions weaken the logical chain and must be resolved."
3,The Novelty-Diversity Matrix™,To evaluate the quality of creative ideas based on their uniqueness and the breadth of their exploration within a solution space.,"When generating or assessing ideas, use the ""novelty and diversity"" criteria. Novelty measures ""how much it deviates from existing solutions"" and its ""uniqueness"". Diversity measures ""how far they are situated in the design space from one another"". Strive for ideas that score high on both, indicating genuinely new and varied approaches, not just minor variations."
3,The Abundance Management Filter™,To efficiently manage and curate a large volume of generated ideas to prevent cognitive overload.,"When faced with ""a large number of ideas generated,"" recognize the ""abundance problem"". Implement a ""structured format for the responses"" or a filtering mechanism that allows for ""quick information retrieval"" and ""assimilate, compare, and shortlist"" the most promising ideas. The goal is to avoid ""decision fatigue"" and ""inconsistencies"" by making the selection process manageable."
3,The Belief Strength Minimizer™,To accurately assess the overall strength of a conclusion in a chain of reasoning when dealing with degrees of belief or partial truths.,"When evaluating an argument where premises or intermediate steps are not simply true or false, but hold with a certain ""degree of belief"" (multivalent logic), apply the ""MIN rule"". This means the overall strength of the conclusion cannot be stronger than the weakest link in the chain of reasoning. Identify the least certain or least believed premise, as this sets the upper bound for the confidence in the final conclusion."
3,The Confident Decision Heuristic Builder™,To derive clear guidelines for decision-making by defining which factors are essential or irrelevant based on varying levels of certainty.,"When developing decision-making guidelines, create ""inclusionary and exclusionary heuristics for different confidence thresholds"". Ask: ""At a high confidence level, which factors must be included? At a lower confidence level, which factors can definitively be excluded?"" This provides ""guiding principles for effective subproblem decomposition"" and identifies the ""most influential variables"" by explicitly defining decision boundaries based on certainty levels."
3,The Multi-Suggestion Root Cause Analyzer™,"To identify the core underlying reason when multiple, potentially conflicting, solutions or explanations are proposed for the same problem.","When faced with ""multiple operation suggestions"" or diverse ideas for a single problem, don't just pick one. Instead, conduct ""further analysis... to identify the the primary factor"" or underlying cause that led to the multiplicity of suggestions. Ask: ""Is there a core ambiguity in the problem statement, a fundamental disagreement in assumptions, or a lack of clarity in objectives that is driving these varied proposals?"" Understanding the root cause of divergence can help reconcile or choose the best path."
3,The Generative-Convergent Synthesis™,"To integrate the expansive nature of ""generative design reasoning"" with the focused evaluation of ""convergent thinking"" to produce novel and viable solutions.","When engaging in problem-solving that requires creativity, consciously combine ""generative design reasoning"" (exploring new possibilities) with ""convergent thinking"" (evaluating and refining ideas). The generative phase focuses on ""original and creative uses"" without practical constraints, while the convergent phase critically assesses their viability and refines them. This dynamic interplay ensures that creative ideas are also practical and effective."
3,The Consensus Vote Optimizer™,"To synthesize the most robust and agreed-upon conclusion from multiple generated possibilities, especially when individual reasoning steps are uncertain.","When facing a situation with multiple plausible intermediate reasoning steps or conclusions, use a ""voting mechanism to determine the most appropriate response"". This involves generating several options (e.g., through divergent thinking or different methods), and then, based on a predefined set of criteria or through a process of aggregation (like majority vote), selecting the ""most consistent rating"" or most agreed-upon option to ""inform the subsequent step of inference""."
3,The Hybrid Approach Synthesizer™,To overcome the limitations of single-paradigm reasoning by intelligently combining different analytical approaches.,"Recognize that purely ""symbolic"" (rule-based logic) or purely ""neural"" (pattern-recognition, intuitive) reasoning each have ""shortcomings"". For problems where one approach falters, seek to combine them into a ""hybrid approach"". For example, use symbolic logic to structure and verify overall coherence, while employing pattern recognition to generate insights from complex data. This leverages complementary strengths."
3,The Argumentative Meta-Ensemble™,"To construct a robust and user-oriented explanation by synthesizing insights from multiple, potentially conflicting, underlying explanations through an argumentative framework.","When a complex argument has multiple possible explanations (some perhaps ""noisy, contradicting""), use a ""meta-explanation ensembling"" approach. Collect insights from these ""multiple explanation techniques"" and integrate them within an ""argumentation framework"". The goal is to produce a ""user-oriented explainability metric"" that is ""truthful"" by identifying consensus and addressing conflicts, even benefiting from the inclusion of diverse perspectives."
3,The Interdependent Feature Mapping™,To improve the accuracy and completeness of explanations by explicitly accounting for how features or premises interact with each other.,"When analyzing an argument, move beyond treating each ""feature"" or premise in isolation. Actively map ""feature dependencies"". Ask: ""Does the impact of premise A change depending on the truth or value of premise B? Are there synergistic or suppressive interactions between different pieces of evidence?"" Explicitly considering these interdependencies leads to a more nuanced and accurate explanation."
3,The Occam's Razor Slicer™ (Simplicity Bias Check),"To evaluate competing explanations or solutions by favoring the simplest one that fits all facts, reducing unnecessary complexity and overthinking.","Drawing from Munger's use of Occam's razor, when testing ideas in Step 3, list hypotheses and ask: ""Among these, which requires the fewest assumptions or entities to explain the evidence?"" Slice away extras: If two explanations fit the data, choose the one without added variables (e.g., avoid invoking rare biases if basic logic suffices). For a flawed argument assuming conspiracy over error, note: ""The simple explanation (human mistake) fits without needing hidden motives."" Cross-check with other latticework tools like base rates to confirm parsimony doesn't ignore probabilities. This sharpens your ""Put It Together"" phase by pruning fluff for robust, elegant reasoning."
3,The Falsification Mindset Probe™ (Popperian Disproof Hammer),"To rigorously test hypotheses or arguments by actively seeking ways to disprove them, strengthening survivors and discarding the weak.","Munger's falsification mindset (via Popper) aligns with Step 3's testing: For each claim, design ""killer experiments"" or questions: ""What evidence would falsify this? If X is true, why isn't Y observed?"" In an argument like ""Exercise always improves health,"" probe: ""What about overtraining or injuries—does data disprove universality?"" Use statistics like base rates (e.g., ""80% improve, but 20% don't—falsified?"") or psychology biases (e.g., confirmation avoidance). If it survives attempted disproof, it's stronger; if not, pivot. Integrate with inversion: ""How would this fail spectacularly?"" This builds antifragile logic by embracing potential refutation."
3,The Correlation-Causation Auditor™ (Causal Chain Inspector),"To distinguish mere associations from true causes, avoiding spurious links that undermine argument validity and decision quality.","From Munger's correlation vs. causation vigilance, in Step 3, audit links: ""Is this correlation causal, or confounded (e.g., Simpson's paradox hiding subgroups)?"" Test with controls: ""If we reverse or remove the factor, does the effect vanish?"" Use game theory (incentives causing illusion) or physics analogies (inertia mimicking causation). Example: ""Ice cream sales correlate with drownings—causation? No, summer heat confounds."" Pair with falsification: Attempt to disprove causality. This ensures your built ideas rest on solid causal foundations, not illusory patterns."
3,The Incentive Superresponse Scanner™ (Motivation Matrix),"To uncover how incentives drive behaviors and biases, revealing hidden influences in arguments, decisions, or systems for more accurate predictions.","Munger's incentives (reward superresponse) fits Step 3: Scan for misalignments—""Whose incentives (principal-agent problems) might skew this claim (e.g., authority bias from paid experts)?"" Map via game theory: ""In this prisoner's dilemma, do rewards encourage defection?"" Use psychology (reciprocity, envy) and economics (moral hazard). Example: In a sales argument, detect scarcity effects inflating value. Test: ""If incentives flipped, would the conclusion hold?"" This dissects lollapalooza effects (bias stacks), ensuring your tests account for human drivers."
3,The Calibration & Scoring Clinic™ (Probability Reliability Tuner),"To systematically calibrate probabilistic judgments in argument evaluations, ensuring overconfidence or underconfidence doesn't skew assessments of likelihoods, strength, or sufficiency.","In Step 3, when assigning degrees of belief (e.g., ""80% chance this premise holds""), log forecasts in a simple journal or app. After outcomes (e.g., new evidence resolves it), score with Brier score: Sum (predicted prob - actual outcome)^2 across items, aiming for ~0.15-0.20 calibration. Run quarterly reviews: Plot reliability curves (e.g., how often 80% predictions succeed). Adjust via debiasing: For overconfidence, force wider ranges; use base rates as anchors. Integrate with Bayesian updating for refinements. This turns subjective ""gut feels"" into reliable, trackable tools, preventing miscalibrated checks that weaken your ""Does It Hold Up?"" phase."
3,The Decision Budget + VOI Gate™ (Analysis Efficiency Guard),"To prevent analysis paralysis by setting explicit stopping rules and evaluating the value of additional information (VOI), ensuring focused, high-impact testing without endless rabbit holes.","During Step 3, pre-set a ""budget"": Time (e.g., 30 min per piece), resources (e.g., 3 sources max), or criteria (e.g., stop if >70% confidence). For each check, compute rough VOI: ""Expected gain from more info (e.g., reducing uncertainty by 20%) × cost (time/effort) > threshold?"" Use decision trees: Branch ""Gather more?"" vs. ""Proceed,"" weighting by expected value. Pre-register stops (e.g., ""If no counter-evidence in 2 searches, accept""). Pair with opportunity cost: ""What else could this time buy?"" This gates over-analysis, keeping your piece-by-piece scrutiny efficient and decisive."
3,The Causal ID Checklist™ (DAG-Driven Assumption Validator),"To rigorously identify causal claims by enumerating assumptions, threats, and estimands, ensuring inferences go beyond correlation without hidden confounders.","In Step 3, for causal links (e.g., ""A causes B""), draw a simple DAG: Nodes for variables, arrows for relations. Checklist: Exchangeability (no unmeasured confounders?), Positivity (all exposed?), SUTVA (no interactions?). List threats (e.g., reverse causation) and test via do-calculus: ""Under intervention (do(A)), does B change?"" Pre-register estimands (e.g., ATE). Use perturbations or IVs for validation. Example: ""Exercise causes health""—check for confounders like diet. Pair with falsification probes. This elevates your ""Does It Hold Up?"" from associative to truly causal, avoiding non-identifiable pitfalls."
3,The Objective & Trade-off Charter™ (Multi-Criteria Balancer),"To explicitly model and weigh conflicting objectives in evaluations, surfacing utility trade-offs, risk attitudes, and fairness for balanced decision-making.","In Step 3, charter criteria: List goals (e.g., accuracy, simplicity, fairness), weights (e.g., 40% logic, 30% evidence fit, 30% robustness via AHP pairwise comparisons). Quantify: Score options on scale (e.g., TOPSIS distances). Surface trade-offs: ""High precision but low equity—acceptable?"" Document attitudes (e.g., loss-averse?). Use decision science: Utility = Sum (weight × value) - risks. Example: Two explanations—one simple but biased—charter picks the net best. Integrate with VOI for unresolved ties. This ensures ""best"" isn't myopic, aligning checks with real-world multi-stakes."
3,The Credibility Graph Builder™ (Source Trust Weaver),"To model and weight source reliability using social epistemology, tracking track records, independence, and echo risks for evidence-based trust calibration.","In Step 3, construct a graph: Nodes for sources/claims, edges weighted by credibility (e.g., +1 track record, -1 conflict). Score: Independence (diverse origins?), Decay (outdated?), Polarization (echo-chamber flag via citation clusters). Aggregate via Bayesian priors on trust. Example: Expert opinion—graph: High if peer-reviewed, low if incentivized. Cross-check with provenance ledgers. Update dynamically. This weaves a trust latticework, ensuring piece checks aren't swayed by unvetted authorities or cascades."
3,The Logical Equivalence Scratchpad™ (Truth-Table Validator),"To quickly detect logical equivalences, contradictions, or tautologies in arguments using truth tables and equivalence rules, accelerating validity checks and POE on abstract or conditional stems.","In Step 3, for conditional or propositional claims (e.g., ""If P then Q""), build a mini truth-table: List all combinations (e.g., P true/false, Q true/false) and evaluate (e.g., P → Q ≡ ¬P ∨ Q holds in all rows). Use a ""equivalence pack"": De Morgan's (¬(P ∧ Q) ≡ ¬P ∨ ¬Q), contrapositive (P → Q ≡ ¬Q → ¬P), material implication (P → Q ≡ ¬P ∨ Q). For shortened tables, assume key values (e.g., test only where antecedent true). Example: Vet answer ""All A are B"" by checking if it matches ¬(exists A not B). This fast-routes flaws like quantifier shifts, saving time on inference items."
3,The Principle Triad Navigator™ (Apply-Justify-Conform Flow),"To handle principle-based items by distinguishing directions of fit—applying rules to cases, justifying cases with rules, or finding conforming rules—streamlining matching and evaluation.","In Step 3, triage by type: 1) Apply: ""Does rule fit facts?"" (e.g., prompt: Match abstract principle to scenario). 2) Justify: ""What rule would support this conclusion?"" (e.g., infer from case to general). 3) Conform: ""Which rule aligns without contradiction?"" (e.g., consistent but not sufficient). Use flows: Diagram rule-case links; POE mismatches. Example: Ethics principle—apply to dilemma; justify action with fairness rule. This triad scaffolds Role/Method items, ensuring precise, direction-aware checks that avoid scope creep."
3,The Causal Probe Playbook™ (Mechanism Diagnostic Kit),"To dissect causal claims in arguments using a structured checklist of alternatives, reverses, and controls, powering Strengthen/Weaken and Paradox resolutions with targeted diagnostics.","In Step 3, deploy 5-probe checklist: 1) Alternative cause (other factors?); 2) Reverse causation (B → A?); 3) Common cause (confounder?); 4) Placebo/controls (bias in setup?); 5) Mechanism plausibility (how exactly?). Test via DAGs or hypotheticals: ""If we control for X, does link hold?"" Example: ""Ads cause sales"" → Probe: Economic boom as alternative? This playbook names levers for causal flaws, accelerating POE and ensuring ""fit/hold up"" verifies true drivers, not illusions."
3,The Trap Taxonomy Rubric™ (Answer-Choice Pathology Scanner),"To accelerate POE by categorizing common distractor pathologies (e.g., out-of-scope, quantifier shifts, necessary/sufficient reversals), labeling traps to cut errors and time on flawed options.","In Step 3, apply rubric to choices: Columns for Trap Type (e.g., Extreme: ""always"" for ""sometimes""; % vs. #: Aggregate vs. individual; Necessary/Sufficient: Confusing conditionals; Out-of-Scope: Irrelevant tangent). Stem-types: Flaw (assumption gaps), Strengthen (partial supports). Example: Answer reverses quantifier (""some"" to ""all"")—label and eliminate. Track personal misses to build intuition. This library turns reactive guessing into systematic dissection, boosting accuracy in verification without overthinking."
3,The Walton Scheme Interrogator™ (Argument Scheme Diagnostic),"To diagnose arguments via high-frequency schemes (e.g., analogy, authority, cause-to-effect) and their critical questions, mirroring strengthen/weaken dynamics for efficient stimulus interrogation.","In Step 3, mini-index 10-12 schemes: E.g., Argument from Analogy—Critical Qs: ""Similar in relevant respects? Differences outweigh?""; Cause-to-Effect: ""Mechanism? Alternatives?""; Authority: ""Expertise? Bias?"" Match stimulus, then probe: ""Does it withstand Qs?"" Example: Expert opinion—ask: ""Consistent with peers?"" POE answers against scheme flaws. This ready-made toolkit speeds flaw detection, aligning checks with argumentation patterns for targeted, scheme-specific verification."
3,The Signal Detection Threshold Setter™ (Hit-Miss Trade-off Balancer),"To optimize decision thresholds under uncertainty by balancing hits/false alarms via base rates and costs, improving accuracy in binary or probabilistic judgments like flaw detection or sufficiency calls.","In Step 3, model SDT: Plot signal (true effect) vs. noise; Set criterion (liberal for sensitivity, conservative for specificity). Compute: Hit rate (true positives, e.g., catch real flaws) vs. False alarm (over-reject good pieces). Adjust by costs: ""Missed flaw cost > false alarm?"" Use base rates: Rare events → Higher threshold. Example: ""Is premise sufficient?""—Calibrate to 70% hit on tests. Pair with Brier scoring. This quantifies trade-offs, tuning your checks for real-world error costs."
3,The VOI Experiment Prioritizer™ (Information Gain Calculator),"To decide if/which additional probes or data are worth pursuing by estimating expected value of information (EVPI/EVSI), preventing inefficient over-gathering in testing phases.","In Step 3, for uncertainties: EVPI = Expected loss from uncertainty (e.g., max utility - expected); EVSI = EVPI reduced by info (e.g., test shrinks range 50%?). Threshold: If EVSI > cost, pursue. Use trees: Branch ""Test?"" vs. ""Decide now."" Example: Ambiguous causal link—EVSI high if pivotal; Skip if low-impact. Integrate decision trees for visuals. This economizes tests, focusing VOI on high-leverage gaps without analysis bloat."
3,The Dimensional Consistency Checker™ (Unit Integrity Guard),"To catch errors in quantitative claims or analogies by verifying unit consistency and scaling, preventing nonsense in evidence-based checks like rates or proportions.","In Step 3, audit: ""Do units align (e.g., % vs. absolute; time scales match)?"" Apply square-cube law for scaling (e.g., ""Doubles size, volume 8x—impact?""). Flag mismatches: ""Growth rate 10% but absolute tiny."" Example: Causal claim—""Correlation 0.9""—check: Per capita or aggregate? Use Fermi for cross-verify. This engineering analogy ensures checks are physically/logically coherent, exposing subtle flaws."
3,The Schelling Focal Point Predictor™ (Coordination Convergence Spotter),"To anticipate where parties converge without explicit agreement in arguments or negotiations, using salient defaults to test assumptions about shared understanding or equilibria.","In Step 3, identify focals: Salient options (e.g., ""50/50 split"" in fairness debates; ""Status quo"" via inertia). Test: ""Does argument assume this convergence (e.g., common knowledge)?"" Probe deviations: Game theory—Prisoner's dilemma escape? Example: Interpretation dispute—""Everyone assumes 'fair' means equal."" Use for rhetoric forensics. This reveals implicit coordinations, strengthening tests of persuasive or cooperative claims."
3,The Indicators & Signposts Tracker™ (Hypothesis Warning System),"To operationalize hypotheses with observable, graded indicators and pre-commit to update rules, creating a falsifiable monitoring framework that reduces ad-hoc reinterpretations.","In Step 3, for key claims, define 4-6 indicators (e.g., strong: Direct evidence; Weak: Absence of counters). Grade (e.g., 0-3 scale); Set milestones (e.g., ""3 weak = Reassess""). Track in a log: Date, Indicator, Grade, Update Action. Example: ""Argument holds""—Signpost: Peer consensus (strong if >80%). Pair with Bayesian ratios for quantification. This builds early-warning into tests, turning vague monitoring into structured, surprise-proof vigilance."
3,The Likelihood Ratio Tally Sheet™ (Evidence Diagnostic Balancer),"To quantify evidence strength by computing likelihood ratios (LRs) for each piece, favoring diagnostic over confirmatory data to avoid overcounting weak supports in evaluations.","In Step 3, for evidence under H1 (claim true) vs. H0 (false), compute LR = P(E"
3,The Forecast Calibration Scoreboard™ (Uncertainty Tracker),"To log and score probabilistic expressions with Brier scores, aggregating for team calibration and building discipline in expressing/using uncertainty during evaluations.","In Step 3, for judgments (e.g., ""Premise 80% sufficient""), log: Prediction, Resolution Date, Outcome (0/1), Brier = (Prob - Outcome)^2. Aggregate: Average <0.20; Extremize groups (e.g., median for ensembles). Quarterly review: Adjust ranges. Example: Flaw probability—Track hits/misses. Use with LR sheets. This enforces numeric discipline, turning vague ""seems"" into improvable, Heuer-aligned accuracy boosters."
3,The Fault Tree Analyzer™ (Argument Failure Engineer),"To systematically map backward from potential false conclusions using FTA/FMEA/Bow-Tie, identifying high-risk modes and barriers for rigorous, engineering-grade testing.","In Step 3, FTA: Top event (False conclusion)—AND/OR gates to causes (e.g., Weak premise ∧ Bad warrant). FMEA: For steps—Severity × Likelihood × Detectability = RPN; Prioritize >100. Bow-Tie: Causes → Event → Consequences; Add controls. Example: Flawed syllogism—Tree: Invalid if quantifier shift. Mitigate with traps rubric. This safety-borrowed method quantifies failure paths, hardening checks against cascades."
3,The VOI Data Triage Gate™ (Evidence Pursuit Economizer),"To evaluate whether additional data justifies the cost by estimating EVPI/EVSI, curbing over-analysis and focusing on pivotal information in testing phases.","In Step 3, for gaps: EVPI = Avg. loss from uncertainty; EVSI = Info's reduction × Prob(change decision). If EVSI > Cost, gather. Example: Ambiguous source—""EVSI low if base rate strong; Skip."" Use trees for branches. Heuer-aligned, this prevents ""collecting"" traps, optimizing probe selection."
