When to Use,Tool Name,Purpose,How
4,The Stream-of-Thought Self-Correction™,"To foster deep, self-aware reasoning by externalizing internal thought processes, including self-interrogation and error detection.","When tackling a difficult problem, adopt a ""Think strategy"" that mimics ""stream-of-consciousness meta-cognition"". Explicitly articulate your ""inner monologue"", including natural language patterns like ""Hmm,"" ""Let me see...,"" or ""Because of this..."" to trigger ""self-verification"". Demand ""explicit backtracking on identified errors"" and record your evolving understanding, including logical flow and inconsistencies, to make your reasoning process transparent to yourself and others."
4,The Meta-Cognitive Pathway Inspector™,"To actively monitor, adjust, and ensure the transparency of reasoning processes, particularly in knowledge representation and complex relationship analysis.","When representing or reasoning with complex knowledge, cultivate ""meta-cognitive abilities to monitor and adjust reasoning processes"". Explicitly document and scrutinize the ""reasoning pathways"" used. Ask: ""Is the flow of logic clear and understandable? Can I trace how different pieces of knowledge are combined and manipulated to reach this conclusion?"". The goal is to make the reasoning as ""human-like, adaptable, and robust"" as possible by ensuring clarity at every step."
4,The Recursive Self-Improvement Loop™,To continuously enhance one's reasoning abilities and problem-solving strategies through iterative self-evaluation and adaptation.,"Adopt a mindset of continuous ""self-improvement"" by regularly evaluating your reasoning performance and adapting your strategies. After attempting a problem or argument, ""analyze its own benchmark evaluation logs"" (i.e., your performance review) to ""diagnose the next potential improvement"". This involves a ""recursive[]"" cycle of learning from past attempts, refining methods, and re-applying them to build ""more advanced capabilities""."
4,The Archive of Explored Paths™,"To foster innovation and avoid local optima by maintaining a diverse record of past reasoning attempts, including successful and less successful ones, as ""stepping stones.""","When tackling novel problems, don't discard past attempts or partial solutions. Instead, build an ""archive of all discovered agents"" (i.e., different reasoning approaches or solutions you've tried). This ""open-ended exploration"" allows you to select ""parent agents"" (previous ideas) to ""self-modify and branch off to produce new agents"" (new, improved lines of reasoning). Recognize that even ""lower-performing nodes"" or seemingly failed paths can contain insights that lead to future ""innovations""."
4,The Self-Explanatory Learning Loop™,To deepen understanding and improve knowledge retention by actively generating explanations for learned material or problem solutions.,"After encountering new information or solving a problem, don't just passively review the answer. Force yourself to ""generat[e] explanations"" for why the solution is correct or how a concept works. This ""self-explanation"" process helps ""integrate new material with prior beliefs,"" ""identify and repair gaps in knowledge,"" and ""resolve potential inconsistencies"", making it a more effective mechanism for learning than simply receiving feedback."
4,The Adaptive Regret Minimizer™,To design robust strategies that can adapt to unforeseen circumstances and minimize negative outcomes across a wide range of uncertainties.,"When making decisions under deep uncertainty, don't aim for a single ""optimal"" plan. Instead, develop ""adaptive strategies designed to minimize regret across the uncertainties"". Identify potential ""vulnerabilities"" and define ""contingency actions"" (e.g., mitigating, hedging, seizing, exploiting) that can be triggered by external forces or adaptation tipping points. This involves planning for how strategies ""could adapt over time"" to maintain robustness."
4,The Collaborative Knowledge Synthesis™,To enrich understanding and develop more robust solutions by actively engaging with diverse stakeholders and integrating their knowledge and feedback.,"Recognize that complex problems benefit from diverse perspectives. Act as a ""knowledge broker"" to facilitate the ""transfer of new knowledge and to facilitate learning"". Actively seek ""feedback from other researchers, and feedback from practitioners"". This ""co-production of knowledge"" can lead to solutions that are ""amenable to all stakeholders"" and improve the ""soundness of future decisions""."
4,The Contradiction Triggered Backtrack™,To efficiently correct reasoning paths by immediately reverting to a prior state upon detecting a contradiction.,"If, during a deductive process, you ""hit upon contradictions,"" immediately ""backtrack"" to the point where the contradiction emerged. This is a critical self-correction mechanism. Analyze the steps leading to the contradiction to identify the faulty premise or inference, similar to how one would debug a proof."
4,The Efficiency and Cost Trade-off Evaluator™,"To select the most effective reasoning strategy by evaluating its efficiency and associated ""cost"" (e.g., cognitive effort, time, resources).","When comparing different reasoning strategies (e.g., a ""Greedy Search"" for a quick answer versus a more exhaustive ""Genetic Algorithm"" approach), evaluate their ""efficiency"". Ask: ""What is the 'mapping rate' (how effectively does it connect problem to solution)? What is the 'average spike transmission cost' (how much cognitive effort/time does it require)?"". Choose the method that provides sufficient accuracy at an acceptable cost for the given problem."
4,The Resilient Subtask Retry™,To enhance the robustness and reliability of a complex plan by building in mechanisms for retrying failed intermediate steps.,"When designing a multi-step plan or complex argument, anticipate potential ""failure"" points in ""subtasks"". Build in a ""retry"" mechanism: if an intermediate step fails, reassess and attempt it again, possibly with a slightly different approach, before concluding overall failure. This fosters ""more resilient behaviors"" and increases the chances of overall success."
4,The Failure Scenario Mapper™,"To proactively identify and understand the most probable pathways to failure, allowing for mitigation and prevention.","Instead of only focusing on success paths, systematically map out ""failure policies"" – ""the likeliest sequence of environments leading to system failure"". Ask: ""What sequence of adverse conditions or logical missteps would most plausibly lead to an incorrect conclusion or an undesired outcome?"" By understanding these ""failure modes,"" you can design more robust arguments and strategies to avoid them."
4,The Designer's Process Traceability™,To analyze the impact of individual choices and actions on the overall reasoning or design process.,"When reflecting on a completed argument or design, trace back the ""influence of designers’ actions on the design process as a whole"". Ask: ""How did specific choices, assumptions, or methods at various stages affect the subsequent development and final outcome? Can I identify the precise points where my individual practices impacted the overall process?"" This helps to understand personal biases and successful strategies."
4,The Successive Approximation Refiner™,To improve complex systems or solutions through iterative refinement based on continuous feedback.,"When building a complex argument or system, recognize it as a ""process of successive approximations"". Actively seek ""additional construction feedback cycles"" to identify and fill ""knowledge and performance gaps."" Each iteration allows you to refine your understanding and solution, moving closer to the desired outcome through incremental improvements."
4,The Predictive Feedback Adjuster™,To continuously refine one's mental models and predictions by using discrepancies between predictions and actual outcomes as feedback.,"When you make a prediction or form a hypothesis, treat the subsequent observation of the actual outcome as ""feedback"". If the prediction is incorrect, use this feedback to ""adjust the network’s internal parameters"" (i.e., your mental model or assumptions) to ""enhance the network’s predictive capabilities for future instances"". This is a continuous learning process driven by error correction, similar to ""backpropagation""."
4,The Core Concept Rehearsal™,"To prevent ""catastrophic forgetting"" of fundamental principles and knowledge when learning new, related information.","When acquiring new knowledge or tackling new problems, regularly ""replay methods"" (revisit and re-engage with) ""representative samples of the original task"" or ""core concepts"". This continuous ""stimulation"" of foundational knowledge helps to maintain its accessibility and prevent it from being overwritten or forgotten as new information is processed."
4,The Belief Update Protocol™,"To systematically revise beliefs and perceptions in light of new information, acknowledging uncertainty and avoiding fixation.","When confronted with new data or developments, consciously engage in ""updating your beliefs"" rather than stubbornly holding onto old ones. Ask: ""How should my current 'perceptions' be revised based on this new information? What is the degree of uncertainty introduced or resolved?"" This systematic updating ensures that your reasoning remains aligned with the most current evidence, similar to Bayesian inference."
4,The Collaborative Transparency Mandate™,To identify limitations and ensure replicability of reasoning processes (especially those involving complex tools) through open discussion and shared standards.,"When engaging in complex reasoning or using advanced analytical tools (metaphorically, ""Generative AI tools""), insist on ""transparent, public discussion"" to ""identify the limitations"". Encourage ""open-source"" approaches where the methodology and data are shared to ""maximize the chances that research can be replicated"". This promotes collective scrutiny and trust."
4,The Iterative Refinement & Exploration™,"To continually improve and strengthen arguments by repeatedly testing, revising, and exploring alternative perspectives.","Adopt a mindset that ""what you are producing might be flawed,"" and be ""prepared to be swayed by the force of the argumentation"". Like Einstein, expect to ""revise his equations many, many times"". Actively seek feedback and ""keep testing and exploring the issues"", making incremental improvements to your reasoning and writing."
4,The Unitary Thought Paragraph™,"To enhance clarity and coherence in written arguments by dedicating each paragraph to a single, distinct idea.","When structuring a written argument, follow the principle that ""each paragraph deals only with one idea"". This ensures a clear logical flow and helps the reader ""navigate your writing"" by processing one complete thought before moving to the next."
4,The Collaborative Reflexive Inventor™,"To enhance individual and group critical thinking by combining originality, flexibility, self-reflection, and collaboration.","When engaging in critical discussions or problem-solving, cultivate a blend of skills: foster ""originality"" (new ideas, counter-examples), maintain ""flexibility of approach,"" and demonstrate ""inventiveness"". Crucially, engage in ""reflexivity skills"" (reflecting on your own thinking and how it's received) and ""co-operativeness"" (working effectively with others). This holistic approach improves both individual insight and collective problem-solving."
4,The Tripartite Failure Diagnostic™,"To systematically diagnose the root cause of a failure in problem-solving by categorizing it into three distinct types: skill, concept, or judgment.","When a solution or approach fails, apply a ""tripartite failure diagnostic"" to understand why:<br>1. Failure of Skill: ""You are not clever enough, or you lack the relevant skills"". Response: Learn more.<br>2. Failure of Concept: ""There is something fundamentally wrong with the initial idea or theory"". Response: ""Ditch the approach decisively and quickly, and move on to something else.""<br>3. Failure of Judgment: ""You can have the right idea, but make the [wrong choice]"". Response: Review decision-making process. This structured diagnosis helps in formulating appropriate corrective actions."
4,The Groupthink Safeguard Protocol™,"To mitigate cognitive biases and ""groupthink"" during collaborative idea generation or decision-making.","When working in groups, be aware that brainstorming can lead to suboptimal outcomes. Implement safeguards:<br>◦ Designate a ""devil's advocate"" to ""challenge assumptions"".<br>◦ ""Consult with outside experts"" to introduce fresh perspectives.<br>◦ ""Break up a big group into smaller ones for discussion before reporting back"". This structured approach promotes independent thought and reduces biases."
4,The Autonomous Confidence Builder™,To foster independent critical thinking and decision-making by cultivating self-reliance and confidence in one's own analysis.,"Develop ""independent thinking and working"" habits, along with ""self-confidence"" in your reasoning. This means trusting your own ""evaluation"" and ""analysis"" even when it diverges from popular opinion, rather than passively accepting others' conclusions. The more you practice independent scrutiny and critical assessment, the more robust your confidence in your own judgment becomes."
4,The Reflective Note-Taker™,To transform passive information consumption into an active process of self-discovery and idea generation.,"When taking notes, don't just passively record information. Instead, treat it as a ""constructive and personal activity"" where you ""‘discover’ your own ideas through the apparently reverse activity of writing down someone else’s"". Actively engage with the material by summarizing, questioning, and connecting it to your existing knowledge, allowing new insights to emerge."
4,The Tentative Hypothesis Adjuster™,To prevent cognitive rigidity and improve decision-making by consciously holding hypotheses provisionally and remaining open to revision.,"When forming a hypothesis or initial conclusion, consciously treat it as ""tentative"". Resist ""becoming fixated on a certain hypothesis"". Actively seek out ""new information"" and be ""open to revising"" your views as evidence emerges, just as ""expert diagnosticians"" do. This approach fosters adaptive and flexible reasoning."
4,The Holistic Progress Evaluator™,"To accurately assess progress and debug reasoning processes by using comprehensive, unbiased feedback.","When evaluating the progress of an argument or problem-solving effort, avoid measures that are ""easy to use even though they are not related to client concerns and are not sensitive to change"". Instead, use feedback methods that provide ""relevant, specific, sensitive, feasible, unintrusive, valid, and reliable"" measures. This rigorous approach allows for ""debugging"" (identifying and remedying errors) and ensures that ""all genuine evaluations produce findings that are better than speculation""."
4,The Information Load Balancer™,"To optimize the presentation of information to prevent ""cognitive overload"" and ensure quality understanding.","When communicating complex information or arguments, actively guard against ""information overload"". Tailor the ""depth of information to be transferred"" based on the ""time and caliber of the recipients"". Prioritize relevant information, summarize judiciously, and use visualization techniques to present complex ideas clearly, ensuring that quantity does not lead to a ""decrease in quality"" of understanding."
4,The Autonomous Reflective Learner™,To foster continuous self-improvement in reasoning by systematically reflecting on past experiences and outcomes.,"Cultivate ""self-reflection mechanisms"". After completing a reasoning task or observing the outcome of a decision, ""reflect on prior failed trajectory"" or problematic interactions. Diagnose possible reasons for failure and ""devise a new, concise, high level plan that aims to mitigate the same failure"". This iterative process enhances your ability to learn from experience and autonomously improve reasoning."
4,The Counterfactual Responsibility Allocator™,To fairly attribute success or failure in collaborative problem-solving and learn from it by considering counterfactual contributions.,"In group reasoning or collaborative tasks, when evaluating outcomes, don't just look at the final result. Apply ""counterfactual rewards"" (metaphorically) to ""mitigate the credit assignment issue"". Ask: ""What would have happened if my contribution (or a specific agent's contribution) had been different? How did each individual's input genuinely affect the outcome, positively or negatively?"" This helps in understanding individual impact and improving future collaboration."
4,The Guided Self-Correction Protocol™,To enhance learning and problem-solving through external guidance combined with internal reflection.,"When seeking to improve your reasoning, imagine an internal ""teacher agent"" providing ""guidance on your step and explains the reasons"". Even if you believe your search or answer was correct, the teacher might prompt you to ""try answering the question in a different way, e.g., try to provide more concise answers, or using the same words as the question itself"". This external-internal feedback loop helps refine communication and understanding."
4,The Real-Time Goal Alignment Feedback™,To continuously align reasoning and actions with explicit goals by providing immediate feedback on performance.,"When engaged in complex problem-solving, define clear ""goals"" and establish mechanisms for ""real-time rewards"" (immediate feedback) for actions that lead to optimal progress toward those goals. This continuous feedback loop helps to ""improve efficiency while overlooking potential noise"" and allows for rapid learning and adaptation, ensuring your reasoning stays on target."
4,The Dual-Process Disentangler™,"To gain a nuanced understanding of how intuitive (""System 1"") and deliberate (""System 2"") reasoning interact and influence judgments.","When analyzing your own (or others') reasoning, acknowledge the interplay of ""dual-process theories"". Actively try to ""disentangle these issues"" by understanding the ""relative speed, intention, control, and interaction"" of these two systems in a given context. For example, identify when an initial intuitive judgment is being overridden or supported by conscious deliberation, and why."
4,The Step-by-Step Rationale Elicitor™,To improve the quality and transparency of reasoning by explicitly requesting a sequential articulation of the thought process.,"When seeking to understand an argument or solve a problem, don't just present the final conclusion. Actively ""prompt[] [yourself/others] to explain its rationale step by step, just like you might expect from a human reasoner being asked to think aloud"". This forces clarity in the inferential chain and often leads to ""more sensible answers"" by revealing hidden assumptions or logical gaps."
4,The Meta-Learning Adaptability Engine™,"To develop the capacity to quickly acquire new skills and adapt to novel problem types, rather than just mastering specific tasks.","Focus on ""learning how to learn new tasks"". Instead of simply memorizing specific solutions, analyze the underlying structure of successful problem-solving processes and the ""history of outcomes incurred by its actions over successive trials"". This builds ""meta-learning"" capabilities, allowing you to infer general strategies that can be redeployed to solve ""new tasks that it has never seen before""."
4,The Dual-Lens Explainer (Factual & Counterfactual)™,To provide a complete understanding of a decision by combining insights into what actually caused it and what could have caused a different outcome.,"When explaining a complex decision, provide both ""factual"" and ""counterfactual"" explanations. Factual explanations highlight ""the input features that have a significant impact on the prediction"" (what did cause it). Counterfactual explanations identify ""the minimum perturbation or change to the input... that leads to a different prediction"" (what could change it). This dual perspective offers a comprehensive and actionable understanding."
4,The Intuitive Explanation Prototyper™,"To leverage innate human intuition about ""what makes a valuable explanation"" to guide the development of effective communication strategies.","When designing an explanation, start by tapping into your ""intuitive understanding of what makes a valuable explanation"". Prototype different ways of explaining the concept, and evaluate them against your gut feeling for clarity, conciseness, and impact. This initial intuitive phase can then be refined with more rigorous testing, but it provides a crucial starting point for effective communication."
4,The Rule Adaptation Meta-Reasoner™,To dynamically adjust and improve one's reasoning by reflecting on and adapting the inference rules being applied.,"Engage in ""higher-order reasoning"" or ""meta-reasoning"". This involves actively ""thinking over your own reasoning processes"". Ask: ""Am I using the most effective inference rules? Are there situations where I should 'learn or forget' certain rules based on their past success or failure?"". This self-awareness and rule adaptation continually refine your deductive inferences."
4,The Intelligent Behavior Heuristic Set™,To guide and evaluate reasoning towards characteristics of effective intelligence.,"When evaluating your reasoning or problem-solving, assess it against the core features of ""intelligent behavior"":<br>◦ Generality: Can this approach be applied effectively in ""a wide range of different tasks and circumstances""?<br>◦ Flexibility: Can it ""adjust behavior in light of changing and/or uncertain circumstances""?<br>◦ Goal-directedness: Does it effectively ""form and pursu[e] goals appropriate to the circumstances""?""Which attribute values in a decision tree had to be changed to alter a classification""** (or decision)?"". This ""intervening"" step helps to understand the sensitive points of the system and allows you to ""improve a classifier after receiving explanations"" by targeting the most impactful variables."
4,The Bayesian Belief Updater™ (Evidence-Weighted Reviser),"To systematically revise conclusions as new evidence emerges, holding beliefs lightly and incorporating probabilistic updates for adaptive learning.","Munger's Bayesian updating suits Step 4: After initial builds, quantify priors (base rates) and likelihoods: ""Given new data, how much should I shift my belief (e.g., from 60% to 40%)?"" Use simple math: Posterior odds = Prior odds × Likelihood ratio. For an evolving argument, ask: ""Does this counter-evidence outweigh confirmation (avoiding bias)?"" Integrate psychology (overconfidence adjustment) and statistics (fat tails for extremes). Example: Update on a hypothesis as facts accumulate, like revising a prediction via Monte Carlo scenarios. This fosters a dynamic, evidence-driven latticework for continuous improvement."
4,The Skin-in-the-Game Validator™ (Stakeholder Accountability Lens),"To evaluate arguments or plans by assessing real personal risk exposure, filtering out low-commitment advice and favoring skin-aligned incentives.","Munger's skin in the game for Step 4: Review: ""Do proponents bear consequences if wrong (e.g., no sunk cost fallacy excuses)?"" Tweak by demanding alignment: ""How would outcomes change with shared stakes?"" Integrate law (fiduciary duty) and psychology (commitment bias). Example: Dismiss anonymous online advice lacking accountability. Use OODA loops for quick validation. This refines your process, weeding out asymmetric-risk thinking for trustworthy, high-stakes reasoning."
4,The Lollapalooza Effect Auditor™ (Bias Cascade Detector),"To identify and dismantle compounding biases that create irrational outcomes, using multidisciplinary checks to break self-reinforcing error chains.","From Munger's lollapalooza (bias stacking), in Step 4, audit: ""Where do multiple tendencies converge (e.g., social proof + scarcity + reciprocity driving hype)?"" List suspects (availability + narrative fallacy) and intervene: ""How to disrupt the cascade (e.g., via negativa removal)?"" Draw on psychology (all listed biases) and game theory (coordination traps). Example: In investment arguments, detect envy + overconfidence + anchoring pile-up. Tweak by isolating one bias at a time. This safeguards reviews, turning vulnerability into vigilant, latticework-powered resilience."
4,The Double-Loop Assumption Challenger™ (Governing Variable Reviser),"To elevate reviews beyond surface fixes by questioning underlying assumptions, goals, or norms that drive reasoning failures, fostering deeper organizational and personal learning.","In Step 4, after tweaking, loop twice: Single-loop (fix action: ""Adjust this premise""); Double-loop (challenge variables: ""Why this goal? Does norm of 'certainty' bias us?""). Prompt: ""If results disappoint, what policy/assumption to revise (e.g., over-reliance on authority)?"" Use ladder of inference to trace leaps. Example: Failed argument—single: Add evidence; Double: Question ""success = consensus"" norm. Pair with meta-cognitive monitors. This transforms tweaks into systemic upgrades, building adaptive, assumption-aware habits."
